{
  "id": "stage3-299",
  "stage": "stage3",
  "difficulty": "EASY",
  "scene_graph": "```json\n{\n  \"objects\": [\n    {\n      \"id\": \"1\",\n      \"name\": \"fireplace\",\n      \"attributes\": {\n        \"location\": \"left side\",\n        \"state\": \"non-functional\"\n      }\n    },\n    {\n      \"id\": \"2\",\n      \"name\": \"vase\",\n      \"attributes\": {\n        \"contains\": \"flowers\"\n      }\n    },\n    {\n      \"id\": \"3\",\n      \"name\": \"television\",\n      \"attributes\": {\n        \"display\": \"fireplace\",\n        \"state\": \"modern\"\n      }\n    },\n    {\n      \"id\": \"4\",\n      \"name\": \"group of people\",\n      \"attributes\": {\n        \"location\": \"in front of television\",\n        \"state\": \"watching\"\n      }\n    }\n  ],\n  \"relationships\": [\n    {\n      \"source\": \"1\",\n      \"relationship\": \"contrasts\",\n      \"target\": \"3\"\n    },\n    {\n      \"source\": \"4\",\n      \"relationship\": \"watching\",\n      \"target\": \"3\"\n    }\n  ]\n}\n```",
  "final_answer": "The humor and satire in the image stem from the juxtaposition of a traditional non-functional fireplace and a modern television displaying a virtual fireplace. \n\nOn the left, there's a real fireplace with flowers in a vase on top, indicating it's not being used for its intended purpose. On the right, a group of people are watching a television that is broadcasting an image of a fireplace. The caption \"YES, BUT\" humorously contrasts the reality of having an inoperative fireplace while choosing to watch a simulated one on TV. \n\nThis highlights the irony of modern life, where technological advances can sometimes lead to absurd situations, such as preferring virtual experiences over real-life ones.",
  "ground_truth": "The images are funny since they show how even though real fireplaces exist, people choose to be lazy and watch fireplaces on television because they dont want the inconveniences of cleaning up, etc. afterwards"
}